{
  "session_id": "d2a40149",
  "metadata": {
    "original_prompt": "Implement comprehensive validation improvements for ha-agent API flow: 1) Add mandatory entity validation to BasicValidationStrategy using Data API client, 2) Add device validation (device IDs, capabilities, health scores), 3) Enhanced safety validation (time constraints, safety score calculation), 4) Device context extraction and validation, 5) Consistency checks between metadata and automation structure, 6) Improved error messages with suggestions, 7) YAML normalization support. All improvements should integrate with existing validation chain and maintain backward compatibility.",
    "created_at": "2025-12-31T07:08:50.748011",
    "config": {
      "stages": {
        "analysis": true,
        "requirements": true,
        "architecture": true,
        "codebase_context": true,
        "quality": true,
        "implementation": true,
        "synthesis": true
      }
    }
  },
  "stages": {
    "analysis": {
      "original_prompt": "Implement comprehensive validation improvements for ha-agent API flow: 1) Add mandatory entity validation to BasicValidationStrategy using Data API client, 2) Add device validation (device IDs, capabilities, health scores), 3) Enhanced safety validation (time constraints, safety score calculation), 4) Device context extraction and validation, 5) Consistency checks between metadata and automation structure, 6) Improved error messages with suggestions, 7) YAML normalization support. All improvements should integrate with existing validation chain and maintain backward compatibility.",
      "intent": "unknown",
      "scope": "unknown",
      "workflow_type": "unknown",
      "domains": [],
      "technologies": [
        "aiohttp",
        "aiosqlite",
        "alembic",
        "fastapi",
        "httpx",
        "openai",
        "pydantic",
        "pydantic-settings",
        "pytest",
        "pytest-asyncio",
        "python-dotenv",
        "pyyaml",
        "sqlalchemy",
        "tenacity",
        "tiktoken",
        "uvicorn[standard]",
        "websockets"
      ],
      "complexity": "medium",
      "analysis": "{'error': 'Unknown command: analyze-prompt'}",
      "parsed_data": {
        "technologies": [
          "aiohttp",
          "aiosqlite",
          "alembic",
          "fastapi",
          "httpx",
          "openai",
          "pydantic",
          "pydantic-settings",
          "pytest",
          "pytest-asyncio",
          "python-dotenv",
          "pyyaml",
          "sqlalchemy",
          "tenacity",
          "tiktoken",
          "uvicorn[standard]",
          "websockets"
        ]
      },
      "detected_libraries": [
        "aiohttp",
        "aiosqlite",
        "alembic",
        "fastapi",
        "httpx",
        "openai",
        "pydantic",
        "pydantic-settings",
        "pytest",
        "pytest-asyncio",
        "python-dotenv",
        "pyyaml",
        "sqlalchemy",
        "tenacity",
        "tiktoken",
        "uvicorn[standard]",
        "websockets"
      ],
      "context7_docs": {
        "aiohttp": false,
        "aiosqlite": false,
        "alembic": false,
        "fastapi": false,
        "httpx": false,
        "openai": false,
        "pydantic": false,
        "pydantic-settings": false,
        "pytest": false,
        "pytest-asyncio": false,
        "python-dotenv": false,
        "pyyaml": false,
        "sqlalchemy": false,
        "tenacity": false,
        "tiktoken": false,
        "uvicorn[standard]": false,
        "websockets": false
      }
    },
    "requirements": {
      "functional_requirements": [],
      "non_functional_requirements": [],
      "technical_constraints": [],
      "assumptions": [],
      "expert_consultations": {},
      "requirements_analysis": "",
      "library_best_practices": {},
      "api_compatibility": {
        "aiohttp": {
          "docs_available": false,
          "best_practices_available": false
        },
        "aiosqlite": {
          "docs_available": false,
          "best_practices_available": false
        },
        "alembic": {
          "docs_available": false,
          "best_practices_available": false
        },
        "fastapi": {
          "docs_available": false,
          "best_practices_available": false
        },
        "httpx": {
          "docs_available": false,
          "best_practices_available": false
        },
        "openai": {
          "docs_available": false,
          "best_practices_available": false
        },
        "pydantic": {
          "docs_available": false,
          "best_practices_available": false
        },
        "pydantic-settings": {
          "docs_available": false,
          "best_practices_available": false
        },
        "pytest": {
          "docs_available": false,
          "best_practices_available": false
        },
        "pytest-asyncio": {
          "docs_available": false,
          "best_practices_available": false
        },
        "python-dotenv": {
          "docs_available": false,
          "best_practices_available": false
        },
        "pyyaml": {
          "docs_available": false,
          "best_practices_available": false
        },
        "sqlalchemy": {
          "docs_available": false,
          "best_practices_available": false
        },
        "tenacity": {
          "docs_available": false,
          "best_practices_available": false
        },
        "tiktoken": {
          "docs_available": false,
          "best_practices_available": false
        },
        "uvicorn[standard]": {
          "docs_available": false,
          "best_practices_available": false
        },
        "websockets": {
          "docs_available": false,
          "best_practices_available": false
        }
      }
    },
    "architecture": {
      "system_design": {},
      "design_patterns": [],
      "technology_recommendations": [],
      "architecture_guidance": "",
      "library_patterns": {},
      "integration_examples": {}
    },
    "codebase_context": {
      "related_files": [],
      "existing_patterns": [],
      "cross_references": [],
      "codebase_context": "No codebase context available"
    },
    "quality": {
      "security_requirements": [],
      "testing_requirements": [
        "Unit tests required",
        "Integration tests for APIs"
      ],
      "performance_requirements": [],
      "code_quality_thresholds": {
        "overall_score": 70.0,
        "complexity_max": 5.0,
        "security_min": 8.0
      }
    },
    "implementation": {
      "task_breakdown": [],
      "implementation_order": [],
      "dependencies": [],
      "estimated_effort": {}
    },
    "synthesis": {
      "instruction": {
        "agent_name": "enhancer",
        "command": "synthesize-prompt",
        "prompt": "Synthesize an enhanced prompt from the following analysis:\n\nOriginal Prompt: Implement comprehensive validation improvements for ha-agent API flow: 1) Add mandatory entity validation to BasicValidationStrategy using Data API client, 2) Add device validation (device IDs, capabilities, health scores), 3) Enhanced safety validation (time constraints, safety score calculation), 4) Device context extraction and validation, 5) Consistency checks between metadata and automation structure, 6) Improved error messages with suggestions, 7) YAML normalization support. All improvements should integrate with existing validation chain and maintain backward compatibility.\n\nAnalysis: {\n  \"original_prompt\": \"Implement comprehensive validation improvements for ha-agent API flow: 1) Add mandatory entity validation to BasicValidationStrategy using Data API client, 2) Add device validation (device IDs, capabilities, health scores), 3) Enhanced safety validation (time constraints, safety score calculation), 4) Device context extraction and validation, 5) Consistency checks between metadata and automation structure, 6) Improved error messages with suggestions, 7) YAML normalization support. All improvements should integrate with existing validation chain and maintain backward compatibility.\",\n  \"intent\": \"unknown\",\n  \"scope\": \"unknown\",\n  \"workflow_type\": \"unknown\",\n  \"domains\": [],\n  \"technologies\": [\n    \"aiohttp\",\n    \"aiosqlite\",\n    \"alembic\",\n    \"fastapi\",\n    \"httpx\",\n    \"openai\",\n    \"pydantic\",\n    \"pydantic-settings\",\n    \"pytest\",\n    \"pytest-asyncio\",\n    \"python-dotenv\",\n    \"pyyaml\",\n    \"sqlalchemy\",\n    \"tenacity\",\n    \"tiktoken\",\n    \"uvicorn[standard]\",\n    \"websockets\"\n  ],\n  \"complexity\": \"medium\",\n  \"analysis\": \"{'error': 'Unknown command: analyze-prompt'}\",\n  \"parsed_data\": {\n    \"technologies\": [\n      \"aiohttp\",\n      \"aiosqlite\",\n      \"alembic\",\n      \"fastapi\",\n      \"httpx\",\n      \"openai\",\n      \"pydantic\",\n      \"pydantic-settings\",\n      \"pytest\",\n      \"pytest-asyncio\",\n      \"python-dotenv\",\n      \"pyyaml\",\n      \"sqlalchemy\",\n      \"tenacity\",\n      \"tiktoken\",\n      \"uvicorn[standard]\",\n      \"websockets\"\n    ]\n  },\n  \"detected_libraries\": [\n    \"aiohttp\",\n    \"aiosqlite\",\n    \"alembic\",\n    \"fastapi\",\n    \"httpx\",\n    \"openai\",\n    \"pydantic\",\n    \"pydantic-settings\",\n    \"pytest\",\n    \"pytest-asyncio\",\n    \"python-dotenv\",\n    \"pyyaml\",\n    \"sqlalchemy\",\n    \"tenacity\",\n    \"tiktoken\",\n    \"uvicorn[standard]\",\n    \"websockets\"\n  ],\n  \"context7_docs\": {\n    \"aiohttp\": false,\n    \"aiosqlite\": false,\n    \"alembic\": false,\n    \"fastapi\": false,\n    \"httpx\": false,\n    \"openai\": false,\n    \"pydantic\": false,\n    \"pydantic-settings\": false,\n    \"pytest\": false,\n    \"pytest-asyncio\": false,\n    \"python-dotenv\": false,\n    \"pyyaml\": false,\n    \"sqlalchemy\": false,\n    \"tenacity\": false,\n    \"tiktoken\": false,\n    \"uvicorn[standard]\": false,\n    \"websockets\": false\n  }\n}\nRequirements: {\n  \"functional_requirements\": [],\n  \"non_functional_requirements\": [],\n  \"technical_constraints\": [],\n  \"assumptions\": [],\n  \"expert_consultations\": {},\n  \"requirements_analysis\": \"\",\n  \"library_best_practices\": {},\n  \"api_compatibility\": {\n    \"aiohttp\": {\n      \"docs_available\": false,\n      \"best_practices_available\": false\n    },\n    \"aiosqlite\": {\n      \"docs_available\": false,\n      \"best_practices_available\": false\n    },\n    \"alembic\": {\n      \"docs_available\": false,\n      \"best_practices_available\": false\n    },\n    \"fastapi\": {\n      \"docs_available\": false,\n      \"best_practices_available\": false\n    },\n    \"httpx\": {\n      \"docs_available\": false,\n      \"best_practices_available\": false\n    },\n    \"openai\": {\n      \"docs_available\": false,\n      \"best_practices_available\": false\n    },\n    \"pydantic\": {\n      \"docs_available\": false,\n      \"best_practices_available\": false\n    },\n    \"pydantic-settings\": {\n      \"docs_available\": false,\n      \"best_practices_available\": false\n    },\n    \"pytest\": {\n      \"docs_available\": false,\n      \"best_practices_available\": false\n    },\n    \"pytest-asyncio\": {\n      \"docs_available\": false,\n      \"best_practices_available\": false\n    },\n    \"python-dotenv\": {\n      \"docs_available\": false,\n      \"best_practices_available\": false\n    },\n    \"pyyaml\": {\n      \"docs_available\": false,\n      \"best_practices_available\": false\n    },\n    \"sqlalchemy\": {\n      \"docs_available\": false,\n      \"best_practices_available\": false\n    },\n    \"tenacity\": {\n      \"docs_available\": false,\n      \"best_practices_available\": false\n    },\n    \"tiktoken\": {\n      \"docs_available\": false,\n      \"best_practices_available\": false\n    },\n    \"uvicorn[standard]\": {\n      \"docs_available\": false,\n      \"best_practices_available\": false\n    },\n    \"websockets\": {\n      \"docs_available\": false,\n      \"best_practices_available\": false\n    }\n  }\n}\nArchitecture: {\n  \"system_design\": {},\n  \"design_patterns\": [],\n  \"technology_recommendations\": [],\n  \"architecture_guidance\": \"\",\n  \"library_patterns\": {},\n  \"integration_examples\": {}\n}\nQuality: {\n  \"security_requirements\": [],\n  \"testing_requirements\": [\n    \"Unit tests required\",\n    \"Integration tests for APIs\"\n  ],\n  \"performance_requirements\": [],\n  \"code_quality_thresholds\": {\n    \"overall_score\": 70.0,\n    \"complexity_max\": 5.0,\n    \"security_min\": 8.0\n  }\n}\nImplementation: {\n  \"task_breakdown\": [],\n  \"implementation_order\": [],\n  \"dependencies\": [],\n  \"estimated_effort\": {}\n}\n\nCreate a comprehensive, context-aware enhanced prompt that includes all relevant information.",
        "parameters": {
          "original_prompt": "Implement comprehensive validation improvements for ha-agent API flow: 1) Add mandatory entity validation to BasicValidationStrategy using Data API client, 2) Add device validation (device IDs, capabilities, health scores), 3) Enhanced safety validation (time constraints, safety score calculation), 4) Device context extraction and validation, 5) Consistency checks between metadata and automation structure, 6) Improved error messages with suggestions, 7) YAML normalization support. All improvements should integrate with existing validation chain and maintain backward compatibility.",
          "stages": "{\n  \"analysis\": {\n    \"original_prompt\": \"Implement comprehensive validation improvements for ha-agent API flow: 1) Add mandatory entity validation to BasicValidationStrategy using Data API client, 2) Add device validation (device IDs, capabilities, health scores), 3) Enhanced safety validation (time constraints, safety score calculation), 4) Device context extraction and validation, 5) Consistency checks between metadata and automation structure, 6) Improved error messages with suggestions, 7) YAML normalization support. All improvements should integrate with existing validation chain and maintain backward compatibility.\",\n    \"intent\": \"unknown\",\n    \"scope\": \"unknown\",\n    \"workflow_type\": \"unknown\",\n    \"domains\": [],\n    \"technologies\": [\n      \"aiohttp\",\n      \"aiosqlite\",\n      \"alembic\",\n      \"fastapi\",\n      \"httpx\",\n      \"openai\",\n      \"pydantic\",\n      \"pydantic-settings\",\n      \"pytest\",\n      \"pytest-asyncio\",\n      \"python-dotenv\",\n      \"pyyaml\",\n      \"sqlalchemy\",\n      \"tenacity\",\n      \"tiktoken\",\n      \"uvicorn[standard]\",\n      \"websockets\"\n    ],\n    \"complexity\": \"medium\",\n    \"analysis\": \"{'error': 'Unknown command: analyze-prompt'}\",\n    \"parsed_data\": {\n      \"technologies\": [\n        \"aiohttp\",\n        \"aiosqlite\",\n        \"alembic\",\n        \"fastapi\",\n        \"httpx\",\n        \"openai\",\n        \"pydantic\",\n        \"pydantic-settings\",\n        \"pytest\",\n        \"pytest-asyncio\",\n        \"python-dotenv\",\n        \"pyyaml\",\n        \"sqlalchemy\",\n        \"tenacity\",\n        \"tiktoken\",\n        \"uvicorn[standard]\",\n        \"websockets\"\n      ]\n    },\n    \"detected_libraries\": [\n      \"aiohttp\",\n      \"aiosqlite\",\n      \"alembic\",\n      \"fastapi\",\n      \"httpx\",\n      \"openai\",\n      \"pydantic\",\n      \"pydantic-settings\",\n      \"pytest\",\n      \"pytest-asyncio\",\n      \"python-dotenv\",\n      \"pyyaml\",\n      \"sqlalchemy\",\n      \"tenacity\",\n      \"tiktoken\",\n      \"uvicorn[standard]\",\n      \"websockets\"\n    ],\n    \"context7_docs\": {\n      \"aiohttp\": false,\n      \"aiosqlite\": false,\n      \"alembic\": false,\n      \"fastapi\": false,\n      \"httpx\": false,\n      \"openai\": false,\n      \"pydantic\": false,\n      \"pydantic-settings\": false,\n      \"pytest\": false,\n      \"pytest-asyncio\": false,\n      \"python-dotenv\": false,\n      \"pyyaml\": false,\n      \"sqlalchemy\": false,\n      \"tenacity\": false,\n      \"tiktoken\": false,\n      \"uvicorn[standard]\": false,\n      \"websockets\": false\n    }\n  },\n  \"requirements\": {\n    \"functional_requirements\": [],\n    \"non_functional_requirements\": [],\n    \"technical_constraints\": [],\n    \"assumptions\": [],\n    \"expert_consultations\": {},\n    \"requirements_analysis\": \"\",\n    \"library_best_practices\": {},\n    \"api_compatibility\": {\n      \"aiohttp\": {\n        \"docs_available\": false,\n        \"best_practices_available\": false\n      },\n      \"aiosqlite\": {\n        \"docs_available\": false,\n        \"best_practices_available\": false\n      },\n      \"alembic\": {\n        \"docs_available\": false,\n        \"best_practices_available\": false\n      },\n      \"fastapi\": {\n        \"docs_available\": false,\n        \"best_practices_available\": false\n      },\n      \"httpx\": {\n        \"docs_available\": false,\n        \"best_practices_available\": false\n      },\n      \"openai\": {\n        \"docs_available\": false,\n        \"best_practices_available\": false\n      },\n      \"pydantic\": {\n        \"docs_available\": false,\n        \"best_practices_available\": false\n      },\n      \"pydantic-settings\": {\n        \"docs_available\": false,\n        \"best_practices_available\": false\n      },\n      \"pytest\": {\n        \"docs_available\": false,\n        \"best_practices_available\": false\n      },\n      \"pytest-asyncio\": {\n        \"docs_available\": false,\n        \"best_practices_available\": false\n      },\n      \"python-dotenv\": {\n        \"docs_available\": false,\n        \"best_practices_available\": false\n      },\n      \"pyyaml\": {\n        \"docs_available\": false,\n        \"best_practices_available\": false\n      },\n      \"sqlalchemy\": {\n        \"docs_available\": false,\n        \"best_practices_available\": false\n      },\n      \"tenacity\": {\n        \"docs_available\": false,\n        \"best_practices_available\": false\n      },\n      \"tiktoken\": {\n        \"docs_available\": false,\n        \"best_practices_available\": false\n      },\n      \"uvicorn[standard]\": {\n        \"docs_available\": false,\n        \"best_practices_available\": false\n      },\n      \"websockets\": {\n        \"docs_available\": false,\n        \"best_practices_available\": false\n      }\n    }\n  },\n  \"architecture\": {\n    \"system_design\": {},\n    \"design_patterns\": [],\n    \"technology_recommendations\": [],\n    \"architecture_guidance\": \"\",\n    \"library_patterns\": {},\n    \"integration_examples\": {}\n  },\n  \"codebase_context\": {\n    \"related_files\": [],\n    \"existing_patterns\": [],\n    \"cross_references\": [],\n    \"codebase_context\": \"No codebase context available\"\n  },\n  \"quality\": {\n    \"security_requirements\": [],\n    \"testing_requirements\": [\n      \"Unit tests required\",\n      \"Integration tests for APIs\"\n    ],\n    \"performance_requirements\": [],\n    \"code_quality_thresholds\": {\n      \"overall_score\": 70.0,\n      \"complexity_max\": 5.0,\n      \"security_min\": 8.0\n    }\n  },\n  \"implementation\": {\n    \"task_breakdown\": [],\n    \"implementation_order\": [],\n    \"dependencies\": [],\n    \"estimated_effort\": {}\n  }\n}",
          "output_format": "markdown"
        }
      },
      "skill_command": "@enhancer synthesize-prompt --original_prompt \"Implement comprehensive validation improvements for ha-agent API flow: 1) Add mandatory entity validation to BasicValidationStrategy using Data API client, 2) Add device validation (device IDs, capabilities, health scores), 3) Enhanced safety validation (time constraints, safety score calculation), 4) Device context extraction and validation, 5) Consistency checks between metadata and automation structure, 6) Improved error messages with suggestions, 7) YAML normalization support. All improvements should integrate with existing validation chain and maintain backward compatibility.\" --stages \"{\n  \"analysis\": {\n    \"original_prompt\": \"Implement comprehensive validation improvements for ha-agent API flow: 1) Add mandatory entity validation to BasicValidationStrategy using Data API client, 2) Add device validation (device IDs, capabilities, health scores), 3) Enhanced safety validation (time constraints, safety score calculation), 4) Device context extraction and validation, 5) Consistency checks between metadata and automation structure, 6) Improved error messages with suggestions, 7) YAML normalization support. All improvements should integrate with existing validation chain and maintain backward compatibility.\",\n    \"intent\": \"unknown\",\n    \"scope\": \"unknown\",\n    \"workflow_type\": \"unknown\",\n    \"domains\": [],\n    \"technologies\": [\n      \"aiohttp\",\n      \"aiosqlite\",\n      \"alembic\",\n      \"fastapi\",\n      \"httpx\",\n      \"openai\",\n      \"pydantic\",\n      \"pydantic-settings\",\n      \"pytest\",\n      \"pytest-asyncio\",\n      \"python-dotenv\",\n      \"pyyaml\",\n      \"sqlalchemy\",\n      \"tenacity\",\n      \"tiktoken\",\n      \"uvicorn[standard]\",\n      \"websockets\"\n    ],\n    \"complexity\": \"medium\",\n    \"analysis\": \"{'error': 'Unknown command: analyze-prompt'}\",\n    \"parsed_data\": {\n      \"technologies\": [\n        \"aiohttp\",\n        \"aiosqlite\",\n        \"alembic\",\n        \"fastapi\",\n        \"httpx\",\n        \"openai\",\n        \"pydantic\",\n        \"pydantic-settings\",\n        \"pytest\",\n        \"pytest-asyncio\",\n        \"python-dotenv\",\n        \"pyyaml\",\n        \"sqlalchemy\",\n        \"tenacity\",\n        \"tiktoken\",\n        \"uvicorn[standard]\",\n        \"websockets\"\n      ]\n    },\n    \"detected_libraries\": [\n      \"aiohttp\",\n      \"aiosqlite\",\n      \"alembic\",\n      \"fastapi\",\n      \"httpx\",\n      \"openai\",\n      \"pydantic\",\n      \"pydantic-settings\",\n      \"pytest\",\n      \"pytest-asyncio\",\n      \"python-dotenv\",\n      \"pyyaml\",\n      \"sqlalchemy\",\n      \"tenacity\",\n      \"tiktoken\",\n      \"uvicorn[standard]\",\n      \"websockets\"\n    ],\n    \"context7_docs\": {\n      \"aiohttp\": false,\n      \"aiosqlite\": false,\n      \"alembic\": false,\n      \"fastapi\": false,\n      \"httpx\": false,\n      \"openai\": false,\n      \"pydantic\": false,\n      \"pydantic-settings\": false,\n      \"pytest\": false,\n      \"pytest-asyncio\": false,\n      \"python-dotenv\": false,\n      \"pyyaml\": false,\n      \"sqlalchemy\": false,\n      \"tenacity\": false,\n      \"tiktoken\": false,\n      \"uvicorn[standard]\": false,\n      \"websockets\": false\n    }\n  },\n  \"requirements\": {\n    \"functional_requirements\": [],\n    \"non_functional_requirements\": [],\n    \"technical_constraints\": [],\n    \"assumptions\": [],\n    \"expert_consultations\": {},\n    \"requirements_analysis\": \"\",\n    \"library_best_practices\": {},\n    \"api_compatibility\": {\n      \"aiohttp\": {\n        \"docs_available\": false,\n        \"best_practices_available\": false\n      },\n      \"aiosqlite\": {\n        \"docs_available\": false,\n        \"best_practices_available\": false\n      },\n      \"alembic\": {\n        \"docs_available\": false,\n        \"best_practices_available\": false\n      },\n      \"fastapi\": {\n        \"docs_available\": false,\n        \"best_practices_available\": false\n      },\n      \"httpx\": {\n        \"docs_available\": false,\n        \"best_practices_available\": false\n      },\n      \"openai\": {\n        \"docs_available\": false,\n        \"best_practices_available\": false\n      },\n      \"pydantic\": {\n        \"docs_available\": false,\n        \"best_practices_available\": false\n      },\n      \"pydantic-settings\": {\n        \"docs_available\": false,\n        \"best_practices_available\": false\n      },\n      \"pytest\": {\n        \"docs_available\": false,\n        \"best_practices_available\": false\n      },\n      \"pytest-asyncio\": {\n        \"docs_available\": false,\n        \"best_practices_available\": false\n      },\n      \"python-dotenv\": {\n        \"docs_available\": false,\n        \"best_practices_available\": false\n      },\n      \"pyyaml\": {\n        \"docs_available\": false,\n        \"best_practices_available\": false\n      },\n      \"sqlalchemy\": {\n        \"docs_available\": false,\n        \"best_practices_available\": false\n      },\n      \"tenacity\": {\n        \"docs_available\": false,\n        \"best_practices_available\": false\n      },\n      \"tiktoken\": {\n        \"docs_available\": false,\n        \"best_practices_available\": false\n      },\n      \"uvicorn[standard]\": {\n        \"docs_available\": false,\n        \"best_practices_available\": false\n      },\n      \"websockets\": {\n        \"docs_available\": false,\n        \"best_practices_available\": false\n      }\n    }\n  },\n  \"architecture\": {\n    \"system_design\": {},\n    \"design_patterns\": [],\n    \"technology_recommendations\": [],\n    \"architecture_guidance\": \"\",\n    \"library_patterns\": {},\n    \"integration_examples\": {}\n  },\n  \"codebase_context\": {\n    \"related_files\": [],\n    \"existing_patterns\": [],\n    \"cross_references\": [],\n    \"codebase_context\": \"No codebase context available\"\n  },\n  \"quality\": {\n    \"security_requirements\": [],\n    \"testing_requirements\": [\n      \"Unit tests required\",\n      \"Integration tests for APIs\"\n    ],\n    \"performance_requirements\": [],\n    \"code_quality_thresholds\": {\n      \"overall_score\": 70.0,\n      \"complexity_max\": 5.0,\n      \"security_min\": 8.0\n    }\n  },\n  \"implementation\": {\n    \"task_breakdown\": [],\n    \"implementation_order\": [],\n    \"dependencies\": [],\n    \"estimated_effort\": {}\n  }\n}\" --output_format \"markdown\"",
      "synthesis_data": {
        "original_prompt": "Implement comprehensive validation improvements for ha-agent API flow: 1) Add mandatory entity validation to BasicValidationStrategy using Data API client, 2) Add device validation (device IDs, capabilities, health scores), 3) Enhanced safety validation (time constraints, safety score calculation), 4) Device context extraction and validation, 5) Consistency checks between metadata and automation structure, 6) Improved error messages with suggestions, 7) YAML normalization support. All improvements should integrate with existing validation chain and maintain backward compatibility.",
        "stages": "<circular reference>",
        "format": "markdown"
      },
      "format": "markdown",
      "metadata": {
        "original_prompt": "Implement comprehensive validation improvements for ha-agent API flow: 1) Add mandatory entity validation to BasicValidationStrategy using Data API client, 2) Add device validation (device IDs, capabilities, health scores), 3) Enhanced safety validation (time constraints, safety score calculation), 4) Device context extraction and validation, 5) Consistency checks between metadata and automation structure, 6) Improved error messages with suggestions, 7) YAML normalization support. All improvements should integrate with existing validation chain and maintain backward compatibility.",
        "stages_used": [
          "analysis",
          "requirements",
          "architecture",
          "codebase_context",
          "quality",
          "implementation"
        ],
        "synthesized_at": "2025-12-31T07:08:52.773502",
        "mode": "cursor-skills"
      }
    }
  }
}